{
  "schema_version": 2,
  "project_id": "project-review-v2",
  "accepted_revision": 3,
  "review_sha256": "aaaaaaaaaaaaaaaaaaaaaaaaaaaaaaaaaaaaaaaaaaaaaaaaaaaaaaaaaaaaaaaa",
  "history_sha256": "bbbbbbbbbbbbbbbbbbbbbbbbbbbbbbbbbbbbbbbbbbbbbbbbbbbbbbbbbbbbbbbb",
  "last_successful_sync": "2026-08-25T08:00:00Z",
  "accounting": {
    "total_duration_ms": 180000,
    "total_tokens": 350,
    "total_cost_usd": 0.0038,
    "models": [
      {
        "model": "gpt-test",
        "total_tokens": 350,
        "total_cost_usd": 0.0038,
        "token_share_pct": 100,
        "cost_share_pct": 100
      }
    ]
  },
  "sessions": [
    {
      "id": "session-report-a",
      "project_id": "project-review-v2",
      "session_id": "session-a",
      "revision": 1,
      "initial_goal": "Freeze the v2 contract",
      "goal_changes": [],
      "phases": [
        {
          "title": "Contract",
          "summary": "Freeze the machine-ledger boundary",
          "evidence": []
        }
      ],
      "files": ["internal/reviewv2/types.go"],
      "commits": [],
      "verification": ["go test ./internal/reviewv2"],
      "decisions_added": [],
      "decisions_revised": [],
      "open_loops_created": [],
      "open_loops_closed": [],
      "previous_session_id": "",
      "next_session_id": "session-z",
      "evidence": [],
      "accounting": {
        "started_at": "2026-08-25T07:00:00Z",
        "ended_at": "2026-08-25T07:01:00Z",
        "duration_ms": 60000,
        "models": [
          {
            "model": "gpt-test",
            "input_tokens": 100,
            "cached_input_tokens": 0,
            "cache_write_input_tokens": 0,
            "output_tokens": 50,
            "reasoning_output_tokens": 0,
            "total_tokens": 150,
            "pricing": {
              "currency": "USD",
              "input_per_million": 4,
              "cached_input_per_million": 0.4,
              "cache_write_input_per_million": 5,
              "output_per_million": 20,
              "source": "https://example.com/pricing",
              "as_of": "2026-08-25"
            },
            "cost_usd": 0.0014
          }
        ],
        "total_tokens": 150,
        "total_cost_usd": 0.0014
      }
    },
    {
      "id": "session-report-z",
      "project_id": "project-review-v2",
      "session_id": "session-z",
      "revision": 1,
      "initial_goal": "Verify deterministic output",
      "goal_changes": [],
      "phases": [],
      "files": ["schemas/review-ledger-v2.schema.json"],
      "commits": [],
      "verification": ["go test ./..."],
      "decisions_added": [],
      "decisions_revised": [],
      "open_loops_created": [],
      "open_loops_closed": [],
      "previous_session_id": "session-a",
      "next_session_id": "",
      "evidence": [],
      "accounting": {
        "started_at": "2026-08-25T07:01:00Z",
        "ended_at": "2026-08-25T07:03:00Z",
        "duration_ms": 120000,
        "models": [
          {
            "model": "gpt-test",
            "input_tokens": 100,
            "cached_input_tokens": 0,
            "cache_write_input_tokens": 0,
            "output_tokens": 100,
            "reasoning_output_tokens": 0,
            "total_tokens": 200,
            "pricing": {
              "currency": "USD",
              "input_per_million": 4,
              "cached_input_per_million": 0.4,
              "cache_write_input_per_million": 5,
              "output_per_million": 20,
              "source": "https://example.com/pricing",
              "as_of": "2026-08-25"
            },
            "cost_usd": 0.0024
          }
        ],
        "total_tokens": 200,
        "total_cost_usd": 0.0024
      }
    }
  ],
  "legacy_compatibility": {
    "current_state": {
      "project_id": "project-review-v2",
      "revision": 3,
      "goal": "",
      "last_verified": "",
      "branch": "",
      "uncommitted_changes": [],
      "blockers": [],
      "open_risks": [],
      "next_action": "",
      "first_inspection": "",
      "last_updated": "",
      "source_sessions": [],
      "evidence": []
    },
    "timeline": [
      {
        "id": "event-a",
        "occurred_at": "2026-08-25T08:00:00Z",
        "revision": 3,
        "class": "verified",
        "title": "",
        "summary": "",
        "evidence": [],
        "decision_ids": ["decision-a"],
        "open_loop_ids": []
      }
    ],
    "decisions": [
      {
        "id": "decision-a",
        "project_id": "project-review-v2",
        "title": "",
        "status": "",
        "revision": 3,
        "tags": [],
        "supersedes": [],
        "source_sessions": [],
        "evidence": [],
        "context": "",
        "rationale": "",
        "consequences": "",
        "reevaluate_when": "",
        "alternatives": [],
        "rejected_paths": []
      }
    ],
    "open_loops": [
      {
        "id": "risk-a",
        "project_id": "project-review-v2",
        "title": "",
        "status": "",
        "revision": 3,
        "tags": [],
        "source_sessions": [],
        "evidence": [],
        "question": "",
        "attempts": [],
        "blocker": "",
        "next_experiment": "",
        "completion_criterion": ""
      }
    ],
    "current_risks": []
  },
  "evidence": [
    {
      "id": "decision-a",
      "refs": [
        {
          "evidence_id": "evidence-decision-a",
          "session_id": "session-a",
          "jsonl_line": 4,
          "source_hash": "cccccccccccccccccccccccccccccccccccccccccccccccccccccccccccccccc",
          "summary": "Selected the <smallest> stable contract"
        }
      ]
    },
    {
      "id": "session-report-z",
      "refs": [
        {
          "evidence_id": "evidence-session-z",
          "session_id": "session-z",
          "jsonl_line": 9,
          "source_hash": "dddddddddddddddddddddddddddddddddddddddddddddddddddddddddddddddd",
          "summary": "Focused tests passed"
        }
      ]
    }
  ]
}
